id,question,A,B,answer
0,对于主题：投资理财，判断下面两个文本是否属于该主题。文本1：使用定期存款可以获得更高的利息收益 文本2：购买理财产品可以有效分散风险,是,否,B
1,对于主题：查询交易记录，判断下面两个文本是否属于该主题。文本1：我需要查询最近一个月的交易记录 文本2：请帮我查一下过去三个月的交易明细,是,否,A
2,对于主题：投资组合管理，判断下面两个文本是否属于该主题。文本1：根据历史数据和风险偏好，优化和调整投资组合的资产配置，以实现收益最大化。 文本2：投资组合管理是一个复杂的过程，需要考虑多个因素，如市场风险、资产收益和投资者的目标。,是,否,B
3,对于主题：股票投资，判断下面两个文本是否属于该主题。文本1：我买入了苹果公司的股票 文本2：我购买了苹果股票,是,否,A
4,对于主题：金融理财，判断下面两个文本是否属于该主题。文本1：通过投资基金可以获得长期稳定的收益 文本2：要注意投资风险，选择合适的理财产品,是,否,B
5,对于主题：投资理财，判断下面两个文本是否属于该主题。文本1：选择合适的投资方式，可以实现财富的增值 文本2：了解市场走势，做出明智的投资决策,是,否,B
6,对于主题：股票买卖，判断下面两个文本是否属于该主题。文本1：我想买入一只蓝筹股 文本2：最近有哪些优质股票可以投资？,是,否,B
7,对于主题：股票交易，判断下面两个文本是否属于该主题。文本1：我买了一只股票，希望能赚点钱。 文本2：你觉得现在是买入股票的好时机吗?,是,否,A
8,对于主题：投资策略，判断下面两个文本是否属于该主题。文本1：根据市场行情波动，制定合理的投资方案 文本2：短期内的投资风险较大，需谨慎考虑,是,否,B
9,对于主题：投资理财，判断下面两个文本是否属于该主题。文本1：根据历史数据，股市投资可能带来高回报率 文本2：通过定期存款，可以在银行获得稳定的利息收益,是,否,B
10,对于主题：投资理财，判断下面两个文本是否属于该主题。文本1：在当前市场环境下，选择适合自己的投资理财产品至关重要。 文本2：财富增值的有效途径之一是通过投资理财获得额外收益。,是,否,B
11,对于主题：利率变动，判断下面两个文本是否属于该主题。文本1：最近的利率变动对我的投资产生了影响。 文本2：请问最近有没有利率变动的消息？,是,否,A
12,对于主题：风险投资，判断下面两个文本是否属于该主题。文本1：投资有风险，入市需谨慎。 文本2：选择合适的投资项目可以获得高回报。,是,否,B
13,对于主题：债券市场，判断下面两个文本是否属于该主题。文本1：公司发行的债券期限为五年，利率为6% 文本2：从市场波动角度看，债券投资风险相对较低,是,否,B
14,对于主题：利率计算，判断下面两个文本是否属于该主题。文本1：按照当前利率计算，您的贷款利息为5000元。 文本2：请提供您贷款的金额和利率，我可以帮您计算贷款的利息。,是,否,B
15,对于主题：房地产投资，判断下面两个文本是否属于该主题。文本1：我打算购买一套在市中心的公寓作为投资物业 文本2：我正考虑投资一些商业地产项目,是,否,A
16,对于主题：理财产品推荐，判断下面两个文本是否属于该主题。文本1：该理财产品的年化收益率为5%，投资期限为12个月 文本2：这款理财产品具有低风险、稳定收益的特点,是,否,B
17,对于主题：股票投资，判断下面两个文本是否属于该主题。文本1：我想投资股票，不知道哪些股票有潜力? 文本2：有没有一些推荐的股票可以投资?,是,否,A
18,对于主题：投资理财，判断下面两个文本是否属于该主题。文本1：你可以购买更多股票来增加投资回报。 文本2：定期存款是一个较为安全的投资方式，利率相对较低。,是,否,B
19,对于主题：投资组合管理，判断下面两个文本是否属于该主题。文本1：通过定期审查和重新平衡投资组合，可以最大程度地降低风险，并同时优化投资回报率。 文本2：在投资组合管理过程中，及时跟踪市场动态和资产表现是非常重要的，以便及时作出调整和优化。,是,否,B
20,对于主题：股票行情查询，判断下面两个文本是否属于该主题。文本1：今日市场大幅下跌，股票价格暴跌 文本2：最新股票行情显示，某股票价格上涨了10%,是,否,B
21,对于主题：储蓄利率，判断下面两个文本是否属于该主题。文本1：该银行的储蓄利率较低，仅为0.5%。 文本2：这家银行设立了一项特别高的储蓄利率，达到了1.5%。,是,否,B
22,对于主题：股票投资，判断下面两个文本是否属于该主题。文本1：我最近购买了几只股票，看到有些股票的价格在上涨。 文本2：我关注了一些股票，发现其中有几只股票的股价在不断攀升。,是,否,A
23,对于主题：股票交易，判断下面两个文本是否属于该主题。文本1：我想买入一些蓝筹股票，寻找长期投资机会。 文本2：请问哪些股票具有较高的盈利潜力？,是,否,A
24,对于主题：合规审计，判断下面两个文本是否属于该主题。文本1：根据合规要求，每年公司都要进行一次全面的合规审计。 文本2：合规审计是确保企业遵守法规和规章制度的重要程序。,是,否,B
25,对于主题：投资理财，判断下面两个文本是否属于该主题。文本1：我想了解最近的投资理财产品有哪些可选？ 文本2：请问您能告诉我最新的投资理财产品有哪些吗？,是,否,A
26,对于主题：股票投资，判断下面两个文本是否属于该主题。文本1：最近股市行情波动较大，很多投资者感到担忧。 文本2：有哪些技术分析方法可以帮助我提高股票投资的盈利概率？,是,否,B
27,对于主题：股票市场，判断下面两个文本是否属于该主题。文本1：昨天股市大跌，投资者纷纷踏空 文本2：最新的股票行情如何，有什么投资建议吗?,是,否,B
28,对于主题：债券投资，判断下面两个文本是否属于该主题。文本1：购买债券可以享受固定利率收益 文本2：债券市场风险与股票市场不同，但仍需谨慎,是,否,B
29,对于主题：理财产品推荐，判断下面两个文本是否属于该主题。文本1：您是否考虑过购买理财产品来增加投资收益? 文本2：您是否有兴趣了解市场上最新的高收益理财产品?,是,否,A
30,对于主题：贷款申请，判断下面两个文本是否属于该主题。文本1：我想申请一笔房屋贷款，用于购买我的梦想之家。 文本2：请问我需要提供哪些材料才能成功申请贷款？,是,否,B
31,对于主题：投资咨询，判断下面两个文本是否属于该主题。文本1：请问我可以投资哪些高收益的金融产品? 文本2：有没有适合稳健投资的低风险产品推荐?,是,否,B
32,对于主题：查询交易记录，判断下面两个文本是否属于该主题。文本1：您可以通过登录账户查看最新的交易记录。 文本2：请联系客服部门以获取最近的交易记录。,是,否,B
33,对于主题：查询交易记录，判断下面两个文本是否属于该主题。文本1：我想查询最近一个月的交易记录 文本2：请问如何在手机银行上查看交易历史?,是,否,B
34,对于主题：理财产品，判断下面两个文本是否属于该主题。文本1：该理财产品的收益率为3%，投资期限为6个月 文本2：这个理财产品是如何风险评级的？,是,否,B
35,对于主题：查询交易记录，判断下面两个文本是否属于该主题。文本1：我想确认我最近的交易记录 文本2：您能帮我查询一下我最近的交易历史吗？,是,否,B
36,对于主题：金融市场涨跌，判断下面两个文本是否属于该主题。文本1：股市今日大涨，全球投资者纷纷买入股票。 文本2：金价逐步下跌，投资者开始抛售黄金。,是,否,B
37,对于主题：股票交易，判断下面两个文本是否属于该主题。文本1：我想买入一些苹果股票 文本2：我准备卖出一部分谷歌股票,是,否,A
38,对于主题：利息计算，判断下面两个文本是否属于该主题。文本1：按照年利率5%计算，本金1000元，一年后的利息为50元。 文本2：假设年利率为5%，计算1000元本金一年后的利息是50元。,是,否,A
39,对于主题：金融投资，判断下面两个文本是否属于该主题。文本1：我想知道如何在股市中进行长期投资 文本2：请告诉我关于长期投资股市的策略,是,否,A
40,对于主题：股票投资，判断下面两个文本是否属于该主题。文本1：我买了几只股票，但是股价一直在下跌。 文本2：这只股票的涨幅已经超过预期了，我想及时出手获利。,是,否,A
41,对于主题：理财产品推荐，判断下面两个文本是否属于该主题。文本1：您可以考虑投资综合型理财产品，以达到分散风险和获取较高收益的目的。 文本2：如果您希望实现中长期财富增值，投资股票型理财产品可能是一个选择。,是,否,A
42,对于主题：投资产品选择，判断下面两个文本是否属于该主题。文本1：我们公司提供多种类型的投资产品，包括股票、债券、基金等。 文本2：我们的投资产品包括各种类别的资产，例如股票、债券和期货。,是,否,B
43,对于主题：投资理财，判断下面两个文本是否属于该主题。文本1：我有一笔闲置资金，想要寻找投资理财的机会。 文本2：有没有适合我投资的项目或基金推荐？,是,否,A
44,对于主题：查询交易记录，判断下面两个文本是否属于该主题。文本1：最近一周内，您的账户发生了10笔交易 文本2：您可以通过网上银行或手机银行查询最近交易记录,是,否,B
45,对于主题：股票交易，判断下面两个文本是否属于该主题。文本1：投资者可以通过在线交易平台买卖股票。 文本2：了解股票市场的趋势可以帮助投资者做出明智的交易决策。,是,否,B
46,对于主题：查询交易记录，判断下面两个文本是否属于该主题。文本1：我需要查一下最近一个月的银行交易记录 文本2：你能告诉我最近一笔消费是在哪个商店吗?,是,否,A
47,对于主题：投资理财，判断下面两个文本是否属于该主题。文本1：分散投资可以降低风险 文本2：短期投资收益较高,是,否,B
48,对于主题：股票交易，判断下面两个文本是否属于该主题。文本1：根据市场走势，我建议你抛售股票，以免亏损 文本2：请问您对某只股票的前景如何看待？,是,否,B
49,对于主题：投资理财，判断下面两个文本是否属于该主题。文本1：我计划投资股票以获取更高的收益 文本2：定期存款是一种较为保守的投资方式,是,否,B
50,对于主题：贷款申请，判断下面两个文本是否属于该主题。文本1：在申请贷款之前需要填写详细的个人和财务信息 文本2：贷款的利率会根据个人信用评级和财务状况来确定,是,否,B
51,对于主题：金融投资，判断下面两个文本是否属于该主题。文本1：你在投资方面有什么计划吗？ 文本2：是否考虑过投资股票或基金？,是,否,A
52,对于主题：信用评级，判断下面两个文本是否属于该主题。文本1：该借款人的信用评级为AAA级，具有非常高的信用度。 文本2：根据我们的信用评级系统，该借款人被评定为AAA级，信用极好。,是,否,A
53,对于主题：投资理财，判断下面两个文本是否属于该主题。文本1：根据过去的数据和趋势分析，市场上的股票和债券都有投资机会。 文本2：投资者应该在选择投资工具时，仔细考虑风险和回报率。,是,否,B
54,对于主题：投资理财，判断下面两个文本是否属于该主题。文本1：股票市场的波动性很高，需要投资者具备足够的风险承受能力和耐心。 文本2：在投资理财中，分散投资和定期定额投资是一些常用的策略。,是,否,B
55,对于主题：个人投资，判断下面两个文本是否属于该主题。文本1：考虑到市场波动性和个人风险承受能力，投资应该分散在不同类型的资产上 文本2：了解了一些投资理财规则，才能更好地做出投资决策,是,否,B
56,对于主题：股票交易，判断下面两个文本是否属于该主题。文本1：最近股市波动较大，需要谨慎操作 文本2：股票市场的行情如何，有什么值得关注的新闻?,是,否,A
57,对于主题：股市行情，判断下面两个文本是否属于该主题。文本1：今天股市大涨，创下新高 文本2：昨天股市大跌，市场恐慌,是,否,B
58,对于主题：股票投资，判断下面两个文本是否属于该主题。文本1：多方力量加速上涨，股市行情乐观。 文本2：市场看跌情绪上升，股票行情可能疲软。,是,否,B
59,对于主题：股票交易，判断下面两个文本是否属于该主题。文本1：我昨天买了100股阿里巴巴股票 文本2：分析显示苹果的股价可能会下跌,是,否,B
60,对于主题：股票投资，判断下面两个文本是否属于该主题。文本1：买入一只低价股票，希望能够获得高额回报 文本2：卖出股票，锁定利润并减少风险,是,否,B
61,对于主题：投资组合管理，判断下面两个文本是否属于该主题。文本1：根据您的投资目标和风险偏好，我们可以帮助您优化投资组合 文本2：是否有明确的投资规划和分散投资的策略?,是,否,B
62,对于主题：金融投资，判断下面两个文本是否属于该主题。文本1：经济增长助推金融市场成为投资热点 文本2：稳健的投资组合是实现财务目标的关键,是,否,B
63,对于主题：股票买卖，判断下面两个文本是否属于该主题。文本1：我想买入一家有潜力的科技股 文本2：经纪人建议卖出目前持有的股票，换买稳定成长的品种。,是,否,B
64,对于主题：股票市场，判断下面两个文本是否属于该主题。文本1：最近股票市场波动较大，投资者应该谨慎处理投资策略。 文本2：最新的股票行情显示，某家公司股价大幅度上涨。,是,否,B
65,对于主题：理财产品购买，判断下面两个文本是否属于该主题。文本1：建议你选择风险低且收益稳定的理财产品 文本2：要注意避免购买高风险的理财产品,是,否,B
66,对于主题：投资理财，判断下面两个文本是否属于该主题。文本1：我打算购买一只风险较高的股票来获取更高的回报。 文本2：我决定将部分资金投资于稳定的债券市场，以保证本金的安全。,是,否,B
67,对于主题：贷款申请，判断下面两个文本是否属于该主题。文本1：您需要提供个人资料和信用记录才能开始贷款申请流程。 文本2：贷款申请需要考虑利率、贷款期限和还款计划。,是,否,B
68,对于主题：金融产品推荐，判断下面两个文本是否属于该主题。文本1：根据您的投资偏好和风险承受能力，有两个适合您的产品 文本2：我们为您挑选了几种不同风险等级的理财产品，供您选择,是,否,B
69,对于主题：资金管理，判断下面两个文本是否属于该主题。文本1：我的资金安全需要得到保障 文本2：我希望我的资金能够得到最优化的利用,是,否,A
70,对于主题：投资理财，判断下面两个文本是否属于该主题。文本1：我考虑将我的闲钱投资于股市 文本2：我想知道最近股市的走势如何,是,否,A
71,对于主题：投资理财，判断下面两个文本是否属于该主题。文本1：他选择了购买低风险的债券产品来保值增值 文本2：她决定将一部分资金投资到股票市场以追求更高收益,是,否,B
72,对于主题：投资理财，判断下面两个文本是否属于该主题。文本1：我打算购买股票来增加我的投资收益 文本2：我正在考虑购买一只股票基金来分散风险,是,否,B
73,对于主题：投资理财，判断下面两个文本是否属于该主题。文本1：我想了解一下长期稳健的投资方式 文本2：有没有适合小额投资的产品推荐?,是,否,A
74,对于主题：股票投资，判断下面两个文本是否属于该主题。文本1：我想买一些蓝筹股来投资 文本2：打算把一部分资金投入到股市,是,否,A
75,对于主题：金融投资，判断下面两个文本是否属于该主题。文本1：我想买些理财产品增加收入 文本2：我要找一个靠谱的投资平台,是,否,A
76,对于主题：理财产品推荐，判断下面两个文本是否属于该主题。文本1：我们推荐XXX理财产品，收益稳定可靠 文本2：这款理财产品投资门槛低，适合大众投资者,是,否,A
77,对于主题：理财产品投资风险，判断下面两个文本是否属于该主题。文本1：请您在购买理财产品前详细了解其风险特点和可能面临的风险 文本2：理财产品投资需要谨慎选择，投资者应根据自身风险承受能力进行合理配置,是,否,B
78,对于主题：金融风险管理，判断下面两个文本是否属于该主题。文本1：根据最新的市场数据，我们需要对投资组合进行重新评估和调整，以降低风险。 文本2：请确保及时关注投资组合的动向，并采取适当的风险管理措施，以避免潜在损失。,是,否,B
79,对于主题：金融行业发展趋势，判断下面两个文本是否属于该主题。文本1：人工智能技术在金融行业中的应用越来越广泛。 文本2：区块链技术被认为是金融行业未来的重要发展方向之一。,是,否,B
80,对于主题：投资理财，判断下面两个文本是否属于该主题。文本1：我应该如何选择合适的投资产品? 文本2：哪些因素应该考虑在内，以制定投资计划?,是,否,A
81,对于主题：股票市场预测，判断下面两个文本是否属于该主题。文本1：根据最新的市场走势分析，预计明天股票市场将出现大幅度上涨。 文本2：过去一周的数据显示，股票市场表现不稳定，投资者应保持谨慎态度。,是,否,B
82,对于主题：投资组合管理，判断下面两个文本是否属于该主题。文本1：通过定期重新平衡投资组合，可以控制风险和优化收益。 文本2：了解市场走势和资产分配是投资组合管理的重要组成部分。,是,否,B
83,对于主题：股票投资策略，判断下面两个文本是否属于该主题。文本1：根据市场走势，选择合适时间买卖股票 文本2：分散投资风险，选择不同行业的股票进行配置,是,否,B
84,对于主题：利率调整，判断下面两个文本是否属于该主题。文本1：最近有没有银行宣布调整贷款利率? 文本2：有哪些银行最近调整了存款利率?,是,否,A
85,对于主题：股票市场预测，判断下面两个文本是否属于该主题。文本1：根据最新的市场趋势分析，明天股票市场可能会出现大幅波动。 文本2：通过技术指标和市场数据的分析，预计股票市场会在接下来的一周保持相对稳定。,是,否,A
86,对于主题：投资策略，判断下面两个文本是否属于该主题。文本1：通过分散投资于多个资产类别，可以降低风险。 文本2：选取一个高收益的投资组合是关键。,是,否,B
87,对于主题：金融投资，判断下面两个文本是否属于该主题。文本1：最近股市的波动性很大，投资者应考虑分散投资风险。 文本2：投资者在进行金融投资时应该注意风险控制，在决策上要谨慎。,是,否,B
88,对于主题：投资风险评估，判断下面两个文本是否属于该主题。文本1：根据最近的市场变动，我的投资已经获得了显著的回报。 文本2：在进行任何投资之前，我会仔细评估风险和潜在回报。,是,否,B
89,对于主题：金融投资，判断下面两个文本是否属于该主题。文本1：我可以帮您查询最新的股票价格 文本2：需要帮助了解投资组合的优化策略吗?,是,否,A
90,对于主题：股票投资，判断下面两个文本是否属于该主题。文本1：最近股市波动较大，投资风险加大。 文本2：公司最新上市的股票表现良好，值得关注。,是,否,B
91,对于主题：投资理财，判断下面两个文本是否属于该主题。文本1：我最近在研究股票投资的策略 文本2：最近我对债券投资也产生了兴趣,是,否,A
92,对于主题：股票市场分析，判断下面两个文本是否属于该主题。文本1：根据技术指标显示，该股票正在形成一个底部反转形态。 文本2：最近这支股票的交易量有明显的增加趋势。,是,否,B
93,对于主题：股票交易，判断下面两个文本是否属于该主题。文本1：我最近开始学习如何进行股票交易。 文本2：我对股票交易有很大兴趣，想了解更多相关信息。,是,否,A
94,对于主题：股票交易，判断下面两个文本是否属于该主题。文本1：股市行情波动较大，投资者应密切关注股票市场的动态。 文本2：购买股票前，需要先了解公司的财务状况和经营业绩。,是,否,B
95,对于主题：股市涨跌，判断下面两个文本是否属于该主题。文本1：股票市场上，股票价格不断上涨，投资者们纷纷获利 文本2：近期，股市呈现出下跌趋势，投资者们表现出担忧情绪,是,否,A
96,对于主题：理财产品选择，判断下面两个文本是否属于该主题。文本1：该理财产品的预期收益率为10%，适合长期投资。 文本2：我们公司推出新的理财产品，该产品将提供更高的利率，欢迎您了解详情。,是,否,B
97,对于主题：投资理财，判断下面两个文本是否属于该主题。文本1：我想了解一下目前市场上的投资理财产品 文本2：对于投资理财，我需要了解哪些方面的信息呢？,是,否,A
98,对于主题：个人理财规划，判断下面两个文本是否属于该主题。文本1：通过投资股票和基金来增加财富 文本2：利用物业投资多元化资产配置,是,否,B
99,对于主题：投资理财，判断下面两个文本是否属于该主题。文本1：我打算将部分资金投资于股市，以追求更高的回报。 文本2：我正在考虑将一部分资金转移到理财产品上，以增加收益。,是,否,A
